Name,Descripción,Enlace
POTENCIA REAL,Parte de la potencia aparente que produce trabajo. Comercialmente se mide en KW.,/taxonomy/term/292/definition
POTENCIA REAL,Parte de la potencia aparente que produce trabajo. Comercialmente se mide en KW.,/taxonomy/term/293/definition
PRECAUCIÓN,Actitud de cautela para evitar o prevenir los daños que puedan presentarse al ejecutar una acción.,/taxonomy/term/294/definition
PREVENCIÓN,Evaluación predictiva de los riesgos y sus consecuencias. Conocimiento a priori para controlar los riesgos. Acciones para eliminar la probabilidad de un accidente.,/taxonomy/term/295/definition
PREVISIÓN,"Anticipación y adopción de medidas ante la posible ocurrencia de un suceso, en función de los indicios observados y de la experiencia.",/taxonomy/term/296/definition
PRIMEROS AUXILIOS,"Todos los cuidados inmediatos y adecuados, pero provisionales, que se prestan a alguien accidentado o con enfermedad repentina, para conservarle la vida.",/taxonomy/term/297/definition
PROCESO DE TRANSFORMACIÓN,"Proceso en el cual los parámetros de la potencia eléctrica son modificados, por los equipos de una subestación.",/taxonomy/term/298/definition
PRODUCTO,"Cualquier bien, ya sea en estado natural o manufacturado, incluso si se ha incorporado en otro producto.",/taxonomy/term/299/definition
PROFESIÓN,"Empleo, facultad u oficio que tiene una persona y ejerce con derecho a retribución.",/taxonomy/term/300/definition
PUERTA CORTAFUEGO,"Puerta que cumple los criterios de estabilidad, estanqueidad, no emisión de gases inflamables y aislamiento térmico cuando se encuentra sometida al fuego o incendio durante un período de tiempo determinado.",/taxonomy/term/301/definition
PUERTO,Punto de interfaz de comunicación entre un equipo y su entorno.,/taxonomy/term/302/definition
PUESTA A TIERRA,"Grupo de elementos conductores equipotenciales, en contacto eléctrico con el suelo o una masa metálica de referencia común, que distribuye las corrientes eléctricas de falla en el suelo o en la masa. Comprende electrodos, conexiones y cables enterrados.",/taxonomy/term/303/definition
PUNTO CALIENTE,"Punto de conexión que esté trabajando a una temperatura por encima de la normal, generando pérdidas de energía y a veces, riesgo de incendio.",/taxonomy/term/304/definition
PUNTO NEUTRO,Es el nodo o punto común de un sistema eléctrico polifásico conectado en estrella o el punto medio puesto a tierra de un sistema monofásico.,/taxonomy/term/305/definition
QUEMADURA,"Conjunto de trastornos tisulares, producidos por el contacto prolongado con llamas o cuerpos de temperatura elevada.",/taxonomy/term/306/definition
RAYO,"La descarga eléctrica atmosférica o más comúnmente conocida como rayo, es un fenómeno físico que se caracteriza por una transferencia de carga eléctrica de una nube hacia la tierra, de la tierra hacia la nube, entre dos nubes, al interior de una nube o de la nube hacia la ionosfera.",/taxonomy/term/307/definition
RECEPTOR,Todo equipo o máquina que utiliza la electricidad para un fin particular.,/taxonomy/term/308/definition
RED EQUIPOTENCIAL,"Conjunto de conductores del sistema de puesta a tierra que no están en contacto con el suelo o terreno y que conectan sistemas eléctricos, equipos o instalaciones con la puesta a tierra.",/taxonomy/term/309/definition
RED INTERNA,"Es el conjunto de redes, tuberías, accesorios y equipos que integran el sistema de suministro del servicio público al inmueble a partir del medidor. Para edificios de propiedad horizontal o condominios, es aquel sistema de suministro del servicio al inmueble a partir del registro de corte general cuando lo hubiere.",/taxonomy/term/310/definition
REGLAMENTO TÉCNICO,"Documento en el que se establecen las características de un producto, servicio o los procesos y métodos de producción, con inclusión de las disposiciones administrativas aplicables y cuya observancia es obligatoria.",/taxonomy/term/311/definition
REQUISITO,"Precepto, condición o prescripción que debe ser cumplida, es decir que su cumplimiento es obligatorio.",/taxonomy/term/312/definition
RESGUARDO,"Medio de protección que impide o dificulta el acceso de las personas o sus extremidades, a una zona de peligro.",/taxonomy/term/313/definition
RESISTENCIA DE PUESTA A TIERRA,Es la relación entre el potencial del sistema de puesta a tierra a medir.,/taxonomy/term/314/definition
RETIE,Acrónimo del Reglamento Técnico de Instalaciones Eléctricas adoptado por Colombia.,/taxonomy/term/315/definition
RIESGO DE ELECTROCUCIÓN,Posibilidad de circulación de una corriente eléctrica mortal a través de un ser vivo.,/taxonomy/term/316/definition
SECCIONADOR,Dispositivo destinado a hacer un corte visible en un circuito eléctrico y está diseñado para que se manipule después de que el circuito se ha abierto por otros medios.,/taxonomy/term/317/definition
SEGURIDAD,Estado de riesgo aceptable o actitud mental de las personas.,/taxonomy/term/318/definition
SEÑALIZACIÓN,Conjunto de actuaciones y medios dispuestos para reflejar las advertencias de seguridad en una instalación.,/taxonomy/term/319/definition
SERVICIO,"Prestación realizada a título profesional o en forma pública, en forma onerosa o no, siempre que no tenga por objeto directo la fabricación de bienes.",/taxonomy/term/320/definition
SERVICIO PÚBLICO,"Actividad organizada que satisface una necesidad colectiva en forma regular y continua, de acuerdo con un régimen jurídico especial, bien sea que se realice por el Estado directamente o por entes privados.",/taxonomy/term/321/definition
SERVICIO PÚBLICO DOMICILIARIO DE ENERGÍA ELÉCTRICA,"Es el transporte de energía eléctrica desde las redes regionales de transmisión hasta el domicilio del usuario final, incluida su conexión y medición.",/taxonomy/term/322/definition
SÍMBOLO,"Imagen o signo que describe una unidad, magnitud o situación determinada y que se utiliza como forma convencional de entendimiento colectivo.",/taxonomy/term/323/definition
SISTEMA,Conjunto de componentes interrelacionados e interactuantes para llevar a cabo una misión conjunta. Admite ciertos elementos de entrada y produce ciertos elementos de salida en un proceso organizado.,/taxonomy/term/324/definition
SISTEMA DE EMERGENCIA,"Un sistema de potencia y control destinado a suministrar energía de respaldo a un número limitado de funciones vitales, dirigidas a garantizar la seguridad y protección de la vida humana.",/taxonomy/term/325/definition
SISTEMA DE POTENCIA AISLADO (IT),"Un sistema con el punto neutro aislado de tierra o conectado a ella a través de una impedancia. Cuenta con un transformador y un monitor de aislamiento. Se utiliza especialmente en centros de atención médica, minas, embarcaciones, vehículos, ferrocarriles y plantas eléctricas.",/taxonomy/term/326/definition
SISTEMA DE PUESTA A TIERRA (SPT),"Conjunto de elementos conductores continuos de un sistema eléctrico específico, sin interrupciones, que conectan los equipos eléctricos con el terreno o una masa metálica. Comprende la puesta a tierra y la red equipotencial de cables que normalmente no conducen corriente.",/taxonomy/term/327/definition
SISTEMA DE PUESTA A TIERRA DE PROTECCIÓN,"Conjunto de conexión, encerramiento, canalización, cable y clavija que se acoplan a un equipo eléctrico, para prevenir electrocuciones por contactos con partes metálicas energizadas accidentalmente.",/taxonomy/term/328/definition
SISTEMA DE PUESTA A TIERRA DE SERVICIO,Es la que pertenece al circuito de corriente; sirve tanto para condiciones de funcionamiento normal como de falla.,/taxonomy/term/329/definition
SISTEMA DE PUESTA A TIERRA TEMPORAL,"Dispositivo de puesta en cortocircuito y a tierra, para protección del personal que interviene en redes desenergizadas.",/taxonomy/term/330/definition
SISTEMA ININTERRUPIDO DE POTENCIA (UPS),"Sistema diseñado para suministrar electricidad en forma automática, cuando la fuente de potencia normal no provea la electricidad.",/taxonomy/term/331/definition
SOBRECARGA,Funcionamiento de un elemento excediendo su capacidad nominal.,/taxonomy/term/332/definition
SOBRETENSIÓN,"Tensión anormal existente entre dos puntos de una instalación eléctrica, superior a la tensión máxima de operación normal de un dispositivo, equipo o sistema.",/taxonomy/term/333/definition
SUBESTACIÓN,"Conjunto único de instalaciones, equipos eléctricos y obras complementarias, destinado a la transferencia de energía eléctrica, mediante la transformación de potencia.",/taxonomy/term/334/definition
SUSCEPTIBILIDAD,"Es la sensibilidad de un dispositivo, equipo o sistema para operar sin degradarse en presencia de una perturbación electromagnética.",/taxonomy/term/335/definition
TABLERO,"Encerramiento metálico o no metálico donde se alojan elementos tales como aparatos de corte, control, medición, dispositivos de protección, barrajes, para efectos de este reglamento es equivalente a panel, armario o cuadro.",/taxonomy/term/336/definition
TÉCNICA,Conjunto de procedimientos y recursos que se derivan de aplicaciones prácticas de una o varias ciencias.,/taxonomy/term/337/definition
TENSIÓN,"La diferencia de potencial eléctrico entre dos conductores, que hace que fluyan electrones por una resistencia. Tensión es una magnitud, cuya unidad es el voltio; un error frecuente es hablar de “voltaje”.",/taxonomy/term/338/definition
TENSIÓN A TIERRA,"Para circuitos puestos a tierra, la tensión entre un conductor dado y el conductor del circuito puesto a tierra o a la puesta a tierra; para circuitos no puestos a tierra, la mayor tensión entre un conductor dado y algún otro conductor del circuito.",/taxonomy/term/339/definition
TENSIÓN DE CONTACTO,Diferencia de potencial que durante una falla se presenta entre una estructura metálica puesta a tierra y un punto de la superficie del terreno a una distancia de un metro. Esta distancia horizontal es equivalente a la máxima que se puede alcanzar al extender un brazo.,/taxonomy/term/340/definition
TENSIÓN DE PASO,"Diferencia de potencial que durante una falla se presenta entre dos puntos de la superficie del terreno, separados por una distancia de un paso (aproximadamente un metro).",/taxonomy/term/341/definition
TENSIÓN DE SERVICIO,"Valor de tensión, bajo condiciones normales, en un instante dado y en un nodo del sistema. Puede ser estimado, esperado o medido.",/taxonomy/term/342/definition
TENSIÓN MÁXIMA DE UN SISTEMA,"Valor de tensión máxima en un punto de un sistema eléctrico, durante un tiempo, bajo condiciones de operación normal.",/taxonomy/term/343/definition
TENSIÓN MÁXIMA PARA UN EQUIPO,"Tensión máxima para la cual está especificado, sin rebasar el margen de seguridad, en lo que respecta a su aislamiento o a otras características propias del equipo.",/taxonomy/term/344/definition
TENSIÓN NOMINAL,"Valor convencional de la tensión con el cual se designa un sistema, instalación o equipo y para el que ha sido previsto su funcionamiento y aislamiento. Para el caso de sistemas trifásicos, se considera como tal la tensión entre fases.",/taxonomy/term/345/definition
TENSIÓN TRANSFERIDA,"Es un caso especial de tensión de contacto, donde un potencial es conducido hasta un punto remoto respecto a la subestación o a una puesta a tierra.",/taxonomy/term/346/definition
TETANIZACIÓN,Rigidez muscular producida por el paso de una corriente eléctrica.,/taxonomy/term/347/definition
TIERRA,"Para sistemas eléctricos, es una expresión que generaliza todo lo referente a conexiones con tierra. En temas eléctricos se asocia a suelo, terreno, tierra, masa, chasis, carcasa, armazón, estructura ó tubería de agua. El término “masa” sólo debe utilizarse para aquellos casos en que no es el suelo, como en los aviones, los barcos y los carros.",/taxonomy/term/348/definition
TIERRA REDUNDANTE,"Conexión especial de conductores de puesta a tierra, para tomacorrientes y equipo eléctrico fijo en áreas de cuidado de pacientes, que interconecta tanto la tubería metálica como el conductor de tierra aislado, con el fin de asegurar la protección de los pacientes contra las corrientes de fuga.",/taxonomy/term/349/definition
TOMACORRIENTE,"Dispositivo con contactos hembra, diseñado para instalación fija en una estructura o parte de un equipo, cuyo propósito es establecer una conexión eléctrica con una clavija.",/taxonomy/term/350/definition
TOXICIDAD,"Efecto venenoso producido por un período de exposición a gases, humos o vapores y que puede dar lugar a un daño fisiológico o la muerte.",/taxonomy/term/351/definition
TRABAJADOR,"Persona que ejecuta un ejercicio de sus habilidades, de manera retribuida y dentro de una organización.",/taxonomy/term/352/definition
TRABAJO,"Actividad vital del hombre, social y racional, orientada a un fin y un medio de plena realización.",/taxonomy/term/353/definition
TRABAJOS EN TENSIÓN,"Métodos de trabajo, en los cuales un operario entra en contacto con elementos energizados o entra en la zona de influencia directa del campo electromagnético que este produce, bien sea con una parte de su cuerpo o con herramientas, equipos o los dispositivos que manipula.",/taxonomy/term/354/definition
TRAMO,"Se define tramo como la fracción de red comprendida entre dos puntos significativos, se caracteriza principalmente por ser aéreo o subterráneo, poseer una longitud determinada y un calibre y  material específico de conductor.",/taxonomy/term/355/definition
TRANSFORMACIÓN DE ENERGÍA ELÉCTRICA,"Proceso mediante el cual la energía eléctrica es transformada en otra forma de energía, tal como calor, fuerza motriz, iluminación, luz, sonido, radiación electromagnética.",/taxonomy/term/356/definition
TRANSMISIÓN DE ENERGÍA ELÉCTRICA,"Transferencia de grandes bloques de energía eléctrica, desde las centrales de generación hasta las áreas de consumo.",/taxonomy/term/357/definition
TRANSMISOR NACIONAL,Persona que opera y transporta energía eléctrica en el sistema de transmisión nacional o que ha constituido una empresa cuyo objeto es el desarrollo de dichas actividades.,/taxonomy/term/358/definition
UMBRAL,"Nivel de una señal o concentración de un contaminante, comúnmente aceptado como de no daño al ser humano.",/taxonomy/term/359/definition
UMBRAL DE PERCEPCIÓN,"Valor mínimo de corriente a partir de la cual es percibida por el 99,5 % de los seres humanos. Se estima en 1,1 miliamperios para los hombres en corriente alterna a 60 Hz.",/taxonomy/term/360/definition
UMBRAL DE REACCIÓN,Valor mínimo de corriente que causa contracción muscular involuntaria.,/taxonomy/term/361/definition
UMBRAL DE SOLTAR O CORRIENTE LIMITE,"Es el valor máximo de corriente que permite la separación voluntaria de un 99,5% de las personas, cuando sujetando un electrodo bajo tensión con las manos, conserva la posibilidad de soltarlo, mediante la utilización de los mismos músculos que están siendo estimulados por la corriente. Se considera como la máxima corriente segura y se estima en 10 mA para hombres, en corriente alterna.",/taxonomy/term/362/definition
URGENCIA,Necesidad de trabajo que se presenta fuera de la programación y que permite realizarse cuando se terminen las tareas en ejecución.,/taxonomy/term/363/definition
USUARIO,"Persona natural o jurídica que se beneficia con la prestación de un servicio público, bien como propietario del inmueble en donde este se presta, o como receptor directo del servicio. A este último usuario se denomina también consumidor.",/taxonomy/term/364/definition
VANO,Distancia horizontal entre dos apoyos adyacentes de una línea o red.,/taxonomy/term/365/definition
VECINDAD DEL PACIENTE,"Es el espacio destinado para el examen y tratamiento de pacientes, se define como la distancia horizontal de 1,8 metros desde la cama, silla, mesa u otro dispositivo que soporte al paciente y se extiende hasta una distancia vertical de 2,30 metros sobre el piso.",/taxonomy/term/366/definition
VIDA ÚTIL,Tiempo durante el cual un bien cumple la función para la que fue concebido.,/taxonomy/term/367/definition
ZONA DE SERVIDUMBRE,"Es una franja de terreno que se deja sin obstáculos a lo largo de una línea de transporte de energía eléctrica, como margen de seguridad para la construcción, operación y mantenimiento de dicha línea, así como para tener una interrelación segura con el entorno.",/taxonomy/term/368/definition